{
  "candidate_hash": "43d05f3556b0ebd6ae85a89c722d1167c5a81a6af3b1425bcbfa0818bd0cf66a",
  "candidate_id": "candidate-de-vat-b2b-cross-border-services-reverse-charge-phase5.6",
  "checklist": {
    "customer_status": "UNRESOLVED",
    "destination_exemption": "UNRESOLVED",
    "effective_dates": "UNRESOLVED",
    "establishment": "UNRESOLVED",
    "eu_national_mapping": "UNRESOLVED",
    "exceptions": "UNRESOLVED",
    "fact_completeness": "UNRESOLVED",
    "invoice_jurisdiction": "UNRESOLVED",
    "reporting_dependencies": "UNRESOLVED",
    "scope": "UNRESOLVED",
    "vat_id": "UNRESOLVED"
  },
  "findings": [
    "BLOCKED: no independent qualified legal/tax reviewer has verified the complete law, effective dates, scope, exceptions, and taxpayer-specific applicability. Structural checks are not legal approval.",
    "BLOCKED: no independent qualified legal/tax reviewer has verified the complete law, effective dates, scope, exceptions, and taxpayer-specific applicability. Structural checks are not legal approval.",
    "Provision-level effective dates are not fully verified for the target transaction date.",
    "Candidate-specific exception analysis is incomplete."
  ],
  "research_hash": "60b8a04622effe249947ac8fb873e9f08817b18dbe847fab55201dd1ec23cc1b",
  "research_id": "research-4f02d5661e1790d85b50",
  "review_hash": "78a529bf29dcbd4ce6c98338df7c29105d604e32bb22611093bc3e920d02288d",
  "review_id": "country-review-788da60b46ae5a013a0a",
  "reviewed_at": "2026-10-08",
  "reviewer_type": "structural-coding-agent-not-independent-legal-review",
  "status": "BLOCKED"
}
