{
  "candidate_hash": "10bf21d200b5e31416496cd02decf5165084c5a8c75e6ee2f1ea3143cacfc117",
  "candidate_id": "candidate-eu-invoice-jurisdiction-219a-phase5.6",
  "checklist": {
    "customer_status": "UNRESOLVED",
    "destination_exemption": "UNRESOLVED",
    "effective_dates": "UNRESOLVED",
    "establishment": "UNRESOLVED",
    "eu_national_mapping": "UNRESOLVED",
    "exceptions": "UNRESOLVED",
    "fact_completeness": "UNRESOLVED",
    "invoice_jurisdiction": "UNRESOLVED",
    "reporting_dependencies": "UNRESOLVED",
    "scope": "UNRESOLVED",
    "vat_id": "UNRESOLVED"
  },
  "findings": [
    "BLOCKED: no independent qualified legal/tax reviewer has verified the complete law, effective dates, scope, exceptions, and taxpayer-specific applicability. Structural checks are not legal approval.",
    "BLOCKED: no independent qualified legal/tax reviewer has verified the complete law, effective dates, scope, exceptions, and taxpayer-specific applicability. Structural checks are not legal approval.",
    "Provision-level effective dates are not fully verified for the target transaction date.",
    "Candidate-specific exception analysis is incomplete."
  ],
  "research_hash": "60b8a04622effe249947ac8fb873e9f08817b18dbe847fab55201dd1ec23cc1b",
  "research_id": "research-4f02d5661e1790d85b50",
  "review_hash": "593f6a266efc97281f1b1f30c2d3c45778cd68f99981a597e38bfb4d107dcb35",
  "review_id": "country-review-a8a3fa69afe648d61983",
  "reviewed_at": "2026-10-08",
  "reviewer_type": "structural-coding-agent-not-independent-legal-review",
  "status": "BLOCKED"
}
